{
  "schema_version": "1.0",
  "incident_id": "scenario-04",
  "policy_version": "v1.0.0",
  "assumptions": {
    "duration_hours": 24,
    "traffic_multiplier": 1.0,
    "region": "ap-northeast-2",
    "service_tier": "S3",
    "org_profile": "ComplianceGuard",
    "severity": "High",
    "regulation_context": { "weight_profile": "strict" }
  },
  "resource_change": {
    "cloudwatch_log_gb_per_day": 10,
    "s3_storage_gb": 100,
    "nat_egress_gb": 5,
    "snapshot_gb": 20
  }
}
